{
  "schema": "feature-spec/1",
  "family": "plate",
  "part": {"number": "BENCH-PLATE-01", "revision": "A", "name": "Fixture plate"},
  "source": {"kind": "benchmark", "note": "Synthetic Phase 0 reference part; not a customer drawing."},
  "units": "in",
  "projection": "third_angle",
  "material": {"designation": "6061-T6 aluminum", "density_g_cm3": 2.70},
  "datums": {"A": "bottom face", "B": "left face", "C": "front face"},
  "dimensions": {
    "D1": {"nominal": 6.000, "upper": 0.005, "lower": -0.005, "kind": "linear", "text": "6.000 ±.005", "tolerance_source": "explicit"},
    "D2": {"nominal": 4.000, "upper": 0.005, "lower": -0.005, "kind": "linear", "text": "4.000 ±.005", "tolerance_source": "explicit"},
    "D3": {"nominal": 0.500, "upper": 0.005, "lower": -0.005, "kind": "linear", "text": ".500 ±.005", "tolerance_source": "title_block"},
    "D4": {"nominal": 0.266, "upper": 0.005, "lower": -0.005, "kind": "diameter", "text": "4X Ø.266 THRU", "tolerance_source": "title_block"},
    "D5": {"nominal": 0.438, "upper": 0.005, "lower": -0.005, "kind": "diameter", "text": "⌴ Ø.438", "tolerance_source": "title_block"},
    "D6": {"nominal": 0.266, "upper": 0.010, "lower": -0.010, "kind": "depth", "text": "↧ .266", "tolerance_source": "title_block"},
    "D7": {"nominal": 0.2500, "upper": 0.0005, "lower": 0.0, "kind": "diameter", "text": "2X Ø.2500 +.0005/-.0000 THRU", "tolerance_source": "explicit", "critical": true},
    "D8": {"nominal": 1.0000, "upper": 0.0010, "lower": 0.0, "kind": "diameter", "text": "Ø1.0000 +.0010/-.0000 THRU", "tolerance_source": "explicit", "critical": true},
    "D9": {"nominal": 0.030, "upper": 0.010, "lower": -0.010, "kind": "chamfer", "text": "C.030 X 45° TOP EDGES", "tolerance_source": "title_block"}
  },
  "features": [
    {"id": "F1", "type": "block", "size": [{"dim": "D1"}, {"dim": "D2"}, {"dim": "D3"}], "dims": ["D1", "D2", "D3"]},
    {"id": "H1", "type": "hole", "face": "top", "hole_type": "clearance",
     "positions": [[0.5, 0.5], [5.5, 0.5], [0.5, 3.5], [5.5, 3.5]],
     "diameter": {"dim": "D4"}, "depth": "thru",
     "counterbore": {"diameter": {"dim": "D5"}, "depth": {"dim": "D6"}}, "dims": ["D4", "D5", "D6"]},
    {"id": "H2", "type": "hole", "face": "top", "hole_type": "tapped",
     "positions": [[2.0, 1.0], [4.0, 1.0], [2.0, 3.0], [4.0, 3.0]],
     "diameter": 0.201, "depth": "thru",
     "thread": {"callout": "4X 1/4-20 UNC-2B THRU", "major": 0.250, "minor": 0.196, "tap_drill": 0.201, "form_tap_drill": 0.228, "depth": "thru"}},
    {"id": "H3", "type": "hole", "face": "top", "hole_type": "reamed",
     "positions": [[1.5, 2.0], [4.5, 2.0]], "diameter": {"dim": "D7"}, "depth": "thru", "dims": ["D7"]},
    {"id": "H4", "type": "hole", "face": "top", "hole_type": "bored",
     "positions": [[3.0, 2.0]], "diameter": {"dim": "D8"}, "depth": "thru", "dims": ["D8"]},
    {"id": "C1", "type": "chamfer", "edges": "top_outer", "size": {"dim": "D9"}, "dims": ["D9"]}
  ],
  "notes": ["BREAK ALL SHARP EDGES .005-.015 (not modeled)", "FINISH: ANODIZE TYPE II CLASS 2 BLACK"],
  "expect": {"bbox": [6.0, 4.0, 0.5], "solids": 1, "volume": 11.273456, "assumes": {"variant": "nominal", "tapped_hole_model": "tap_drill"}}
}
